<?xml version="1.0" encoding="UTF-8"?>
<!-- - - - - - - - - - - - - - - - - - - - - - - - - - - - - - - - - - - - - - - - - - -->
<!-- Copyright:                                                                        -->
<!--     Dit document is eigendom van Platform BISON onder Samenwerkingsverband DOVA   -->
<!--     en wordt gepubliceerd onder de Creative Commons Licentie by-nd/3.0/nl,        -->
<!--     zie http://creativecommons.org/licences/by-nd/3.0/nl                          -->
<!-- Dit XSD is gerelateerd aan het TMI9 NeTEx NL Profiel en het TMI9 SIRI NL Profiel  -->
<!--                                                                                   -->
<!-- Versie:  v20190501a                                                               -->
<!--                                                                                   -->
<!-- Historie:                                                                         -->
<!--   v20190501  (mei 2019)     initiele versie                                       -->
<!--   v20190501a (januari 2020) copyright aangepast                                   -->
<!-- - - - - - - - - - - - - - - - - - - - - - - - - - - - - - - - - - - - - - - - - - -->
<PublicationDelivery xmlns="http://www.netex.org.uk/netex" xmlns:xsi="http://www.w3.org/2001/XMLSchema-instance" xsi:schemaLocation="http://www.netex.org.uk/netex predefined-bison-v910.xsd" version="9.1.0">
	<PublicationTimestamp>2019-05-01T00:00:00Z</PublicationTimestamp>
	<ParticipantRef>BISON</ParticipantRef>
	<Description>BISON lijst met voorgedefinieerde soorten apparatuur m.b.t. toegankelijkheid, versie 20190501</Description>
	<dataObjects>
		<GeneralFrame id="BISON:GeneralFrame:Predefined_TypeOfEquipment" version="20190501">
			<Description>Lijst met voorgedefinieerde soorten apparatuur m.b.t. toegankelijkheid. Deze lijst wordt bijgehouden door BISON. De lijstelementen (TypeOfEquipment) kunnen desgewenst (ongewijzigd!) worden overgenomen in een gegevenslevering conform het Nederlands NeTEx Profiel.</Description>
			<TypeOfFrameRef ref="BISON:TypeOfEquipmentValues"/>
			<members>
				<ValueSet id="BISON:ValueSet:TypeOfEquipment">
					<values>
						<TypeOfEquipment id="BISON:TypeOfEquipment:automaticRamp">
							<Name>automaticRamp</Name>
							<Description>Elektrische oprijplaat</Description>
						</TypeOfEquipment>
						<TypeOfEquipment id="BISON:TypeOfEquipment:manualRamp">
							<Name>manualRamp</Name>
							<Description>Handbediende oprijplaat</Description>
						</TypeOfEquipment>
						<TypeOfEquipment id="BISON:TypeOfEquipment:slidingStep">
							<Name>slidingStep</Name>
							<Description>Opstaptrede</Description>
						</TypeOfEquipment>
						<TypeOfEquipment id="BISON:TypeOfEquipment:wheelchairLift">
							<Name>wheelchairLift</Name>
							<Description>Rolstoellift</Description>
						</TypeOfEquipment>
						<!-- WELLICHT NOG AANVULLEN -->
					</values>
				</ValueSet>
			</members>
		</GeneralFrame>
	</dataObjects>
</PublicationDelivery>
